"Business name","Phone","Email","Website","State","City","Address"
"High Standards","949-973-0322","highstandardsoc@gmail.com","","Rancho Santa Margarita","CA","Rancho Santa Margarita, CA United States 92688"
"KUSHAGRAM","949-750-2001","Donations@kushagram.com","","Rancho Santa Margarita","California","Rancho Santa Margarita, California US 92688"
"Puffy Delivery - RSM","949-619-6089","support@puffydelivery.com","http://puffydelivery.com","Rancho Santa Margarita","California","Rancho Santa Margarita, California US 92688"
"1-866-DELIVERY","1-866-DELIVERY","info@DeliveryGreens.com","http://www.DeliveryGreens.com","Rancho Santa Margarita","CA","Rancho Santa Margarita, CA USA 92688"
"KUSHAGRAM - RSM","949-750-2001","Donations@kushagram.com","http://kushagram.com","RSM","California","RSM, California US 92688"
"PharmSquad- Rancho Santa Margarita","888-627-7958","info@pharmsquad.com","http://www.pharmsquad.com","Rancho Santa Margarita","California","Rancho Santa Margarita, California US 92688"
"Premium Meds Delivery","949-278-6830","premiummedsoc@gmail.com","","R.S.M.","California","R.S.M., California US 92688"
"Rancho Weeds","949-546-5330","ranchoweeds@gmail.com","","Rancho Santa Margarita","California","Rancho Santa Margarita, California US 92688"
